{"change_log":[{"current":6,"field":"score.adjusted","previous":7,"reason":"Completed weekly momentum exhaustion credit disappears; fresh valuation/reserve classifications persist. Capitulation1 held with explicit data debt."},{"current":[3,6],"field":"gates.passed","previous":[3,6,7,9],"reason":"Macro gate9 dark on oil/rate pressure; liquidation gate7 no longer live and not counted."},{"current":"-74233238.84","field":"spot_cvd_3d","previous":"307231925.69","reason":"Compare equal3d deltas, never rebased cumulative levels: flow flipped to selling."},{"current":0,"field":"score.discretion","previous":-0.5,"reason":"No fresh load-bearing two-family discretion case adopted. Prior ETH overextension term retired on fresh review; this does not unlock a phase."},{"current":"DATA_LIMITED","field":"position.status","previous":"DATA_LIMITED","reason":"Same newest valid export and same unexplained custody. No inferred flat/reset."}],"companion_framework":{"framework":"flying_rocket","gates":null,"rationale":"Java same-snapshot companion floor 4, ceiling 10; channel none. Missing distribution/vulnerability counts are unknown, not true zero. Both assets remain >20% below1y high and above rising200dma; no active FR channel. Cap applied=False; do not claim a binding cap in channel none. Full HardRule5 dischargeable=False. Prior standalone FR obligation from Aug22 remains owed (2 FK reports outstanding); last standalone Aug21 predates it. Inline calculation does not discharge that obligation.","score":4,"status":"DATA_LIMITED"},"cross_validation":{"rationale":"Cross-validation UNVERIFIED — standalone FR obligation outstanding 2 reports. No both>=12 conflict is possible on these bounds, but unknown companion counts straddle the >=9 standalone threshold; full cross-validation is not asserted or used to support the verdict.","relationship":"FK 6 versus partial FR 4-10","status":"DATA_LIMITED"},"data_gaps":[{"field":"custody","impact":"No position-sized hold, trim, exit, stop, PnL or cover instruction. Market report continues.","source_ids":["ledger"],"status":"DATA_LIMITED"},{"field":"liquidation_distribution","impact":"Capitulation leg1 held from prior, debt1 this cycle; gate7 provisional/non-counted. Top-decile/3sigma current claim not verified.","source_ids":["liquidations","prior"],"status":"DATA_LIMITED"},{"field":"true_lth30d","impact":"Prior zero LTH subcomponent retained; no LTH gate. Provider-gated; fresh Glassnode prose and staking do not replace quantitative30d supply.","source_ids":["coinmetrics","glassnode"],"status":"NOT_COVERED"},{"field":"ETF_YTD_AUM","impact":"YTD and synchronized all-fund AUM unverified. No ratio invented; trailing-month net flow is positive regardless. ETH headline AUM rejected as internally inconsistent.","source_ids":["farside","sosovalue"],"status":"DATA_LIMITED"},{"field":"FR_counts","impact":"Distribution/vulnerability unverified; companion is an explicit range, not a full score.","source_ids":["snapshot"],"status":"DATA_LIMITED"},{"field":"cross_exchange_flow","impact":"Binance single venue only; never promoted to automatic legacy score/gate.","source_ids":["snapshot"],"status":"DATA_LIMITED"},{"field":"macro_endpoint","impact":"FRED realyield and2y recovered via official web. HY OAS/NFCI/netliquidity unavailable this cycle; VIX holiday-labelled close not a trading-session observation.","source_ids":["snapshot","realyield","us2y"],"status":"DATA_LIMITED"}],"deployment":{"deployed_pct":"0","dry_pct":"100","throttle_released":false,"tranches":[{"channel":null,"deployed":false,"entry_price":null,"pct":"10","phase":"1A","prior_stop":null,"prior_time_stop":null,"rationale":"LOCKED: 2 score points short; 1 total gates short; 1 V gates short. Score AND breadth bind. Prior named planning zone 1750-1880 unchanged; no order authorized.","state":"LOCKED","stop":null,"tag":"FK-P1A-ETH-20260907-2055","time_stop":null},{"channel":null,"deployed":false,"entry_price":null,"pct":"15","phase":"1B","prior_stop":null,"prior_time_stop":null,"rationale":"LOCKED: 5 score points short; 3 total gates short; 2 V gates short. Score AND breadth bind. Prior named planning zone 1650-1750 unchanged; no order authorized.","state":"LOCKED","stop":null,"tag":"FK-P1B-ETH-20260907-2055","time_stop":null},{"channel":null,"deployed":false,"entry_price":null,"pct":"30","phase":"2","prior_stop":null,"prior_time_stop":null,"rationale":"LOCKED: 9 score points short; 4 total gates short; 2 V gates short. Score AND breadth bind. Prior named planning zone 1450-1600 unchanged; no order authorized.","state":"LOCKED","stop":null,"tag":"FK-P2-ETH-20260907-2055","time_stop":null},{"channel":null,"deployed":false,"entry_price":null,"pct":"45","phase":"3","prior_stop":null,"prior_time_stop":null,"rationale":"LOCKED: 11 score points short; 5 total gates short; 3 V gates short. Score AND breadth bind. No new zone; any older named floor still governs coherence.","state":"LOCKED","stop":null,"tag":"FK-P3-ETH-20260907-2055","time_stop":null}]},"ev":{"arithmetic_status":"CHECKED","note":"3-30 day terminal scenario matrix. D4 weights20/40/25/15. Versus score6-10 baseline20/35/30/15: 0/+5/-5/0 pp; shift Retest to Range on reserve support, not to bullish conviction. Active downtrend NO; trend residual0. Rally20%<=50%. Prior EV -0.19%; spot since prior +2.16%: prior sign contradicted. Recomputed from distinct-date machine reports: negative-sign streak 18 including current; 5/17 completed intervals correct (29.4%). Machine records lacking parseable spot/EV excluded as UNKNOWN, never read as a flip. The Aug22 prose claimed19 negative reports; that count is not reproducible from the available parseable machine history, so this is a labeled continuity correction rather than a reset. EV stays corroborative-only under the existing systematic-bias flag; it cannot carry WAIT or lift the collar. EV versus spot -5.67% alongside realized trailing14-calendar-day spot change +0.36% (Aug24 daily close to current).","probability_sum":1,"scenarios":[{"high":"2800","low":"2550","mid":"2675","name":"Rally","probability":0.2,"rationale":"Cool CPI / easing oil, renewed spot demand and break of current resistance."},{"high":"2550","low":"2350","mid":"2450","name":"Range","probability":0.4,"rationale":"Consolidation around current daily structure; terminal band, not an assertion the low is in."},{"high":"2350","low":"2050","mid":"2200","name":"Retest","probability":0.25,"rationale":"Hot CPI or sustained spot selling retests the daily support/200-day region."},{"high":"2050","low":"1750","mid":"1900","name":"Bear","probability":0.15,"rationale":"Oil/rates shock and failed major-MA support revisit summer price territory."}],"stated_ev":"2350","vs_spot_pct":"-5.67"},"events":[{"as_of":"2026-09-08T00:55:21Z","impact":"US sessions Sep8,9,10,11,14 (Sep7 Labor Day closed): CPI Fri Sep11 08:30 ET is the only named tier1 release inside the next5 sessions. Payroll already released Sep4, next Oct2; PCE Sep30; FOMC Sep15-16 decision Sep16 14:00 ET, minutes last Aug19/next Oct7. PPI Thu Sep10 08:30 ET is also watched. Dates verified against BLS/BEA/Fed schedules; crypto trades every day. No automatic pre-event deployment pause.","name":"Tier1 calendar","status":"AVAILABLE"},{"as_of":"2026-09-03","impact":"Standard Chartered launched UAE institutional BTC/ETH spot trading; structural access benefit, no immediate FK gate or score credit.","name":"Institutional access","status":"AVAILABLE"},{"as_of":"2026-09-04","impact":"Latest full US week +215.3M; latest day +25.9M. Labor Day means Sep4 remains latest completed ETF session.","name":"ETF update","status":"AVAILABLE"}],"evidence":{"altseason":{"as_of":"2026-09-08","confidence":"MEDIUM","rationale":"Below75; not broad altcoin season. Context only.","source_ids":["altseason"],"status":"AVAILABLE","unit":"top50 90d breadth index","value":"41"},"correlation":{"as_of":"2026-09-04","confidence":"MEDIUM","rationale":"30 aligned closes / 29 log returns; not price-level correlation. Surcharge OFF if <=0.7; no guessed bonus.","source_ids":["correlation"],"status":"AVAILABLE","unit":"Pearson daily log-return correlation","value":"0.08996003"},"cpi":{"as_of":"2026-08-12","confidence":"MEDIUM","rationale":"Latest release; next CPI Sep11 08:30 ET.","source_ids":["cpi"],"status":"AVAILABLE","unit":"percent YoY July","value":"3.4 headline / 2.5 core"},"etf_flows":{"as_of":"2026-09-04","confidence":"MEDIUM","rationale":"Daily +25.9M; Aug31-Sep4 +215.3M; SepMTD +127.7M. Latest inflow streak 2 sessions. Sep7 US Labor Day closure; no zero-flow invented. YTD total NOT VERIFIED; conflicting window totals are not annual totals. AUM ratio unavailable; positive net flow cannot meet an outflow gate.","source_ids":["farside","sosovalue"],"status":"AVAILABLE","unit":"USD millions Aug10-Sep4","value":"1720.6"},"holder":{"as_of":"2026-09-06","confidence":"MEDIUM","rationale":"True LTH data provider-gated: its half holds prior zero; reserves fall, holder1.5. Staking level is context, not a substitute for LTH30d.","source_ids":["coinmetrics","snapshot"],"status":"AVAILABLE","unit":"exchange reserves change 30d %","value":"-2.223"},"jobs":{"as_of":"2026-09-04","confidence":"MEDIUM","rationale":"Realized official data; not a forecast of September FOMC.","source_ids":["jobs"],"status":"AVAILABLE","unit":"jobs / percent August","value":"162000 payroll / 4.1 unemployment"},"liquidations":{"as_of":null,"confidence":"NONE","rationale":"NOT FOUND: prior capitulation leg1 retained under stale-input debt; positive funding and positive ETF flow earn no current points. Liquidation component held, not relit. Score range without carry 5-6.","source_ids":["liquidations","prior"],"status":"DATA_LIMITED","unit":"market-wide 24h / historical percentile","value":null},"macro":{"as_of":"2026-09-08","confidence":"MEDIUM","rationale":"Brent strength and inflation/rate risk keep gate9 dark despite slightly softer DXY and new institutional access.","source_ids":["snapshot","news","jobs",